Interactive Promo;https://ru.wordpress.org/plugins/interactive-promo/;Engage your potential audience with an exciting promo.;100+ активных установок;6.6.2ImportDoc Block;https://ru.wordpress.org/plugins/importdoc-block/;Put the contents of a Google Doc in a WordPress post. When you update the Google Doc changes reflect on your website instantly.;100+ активных установок;5.2.21Gosign — Accordion Slider Block;https://ru.wordpress.org/plugins/gosign-accordion-slider-block/;Create Accordion Slider with Latest Wordpress Gutenberg, optional Lightbox for images preview.;100+ активных установок;5.8.10Child Pages Block;https://ru.wordpress.org/plugins/get-subpages-list/;Gutenberg block gets child pages list of specific page;100+ активных установок;5.5.15Gosign — Google Maps Block;https://ru.wordpress.org/plugins/gosign-google-maps-block/;Add Google Maps, Custom Style Google Maps, Markers, Info Windows, Marker animations and many more.;100+ активных установок;6.0.9LSX Blocks;https://ru.wordpress.org/plugins/lsx-blocks/;This plugin extends the LSX Theme to support the latest block editor features.;100+ активных установок;6.3.5Bokez — WordPress 5 Blocks;https://ru.wordpress.org/plugins/bokez-awesome-gutenberg-blocks/;Build a beautiful website in minutes with best 15 essential Wordpress blocks. Customizable and super easy to use.;100+ активных установок;5.3.0Gosign — Notification And Alert Block;https://ru.wordpress.org/plugins/gosign-notification-and-alert-block/;Plugin contains the options to set notification or alert blocks. It offors multiple options to customise the block i.e headlines fonts, sizes, colors, …;100+ активных установок;6.0.9Beauty Box Block;https://ru.wordpress.org/plugins/beauty-box-block/;Add a customizable box around your content.;90+ активных установок;6.7.2Deligent — Variable Column Blocks;https://ru.wordpress.org/plugins/deligent-variable-block-width/;The plugin facilitates the user can add the progress counter block.;90+ активных установок;5.1.19Gosign — Grid Container Block;https://ru.wordpress.org/plugins/gosign-grid-container-block/;plugin creates single or multiple column blocks on single click Site https://gosign.de./;90+ активных установок;6.0.9WPlyr Media Block;https://ru.wordpress.org/plugins/wplyr-media-block/;WPlyr is an easy-to-use Gutenberg block which implements Plyr — A simple, lightweight and accessible HTML5, YouTube and Vimeo media player that suppor …;90+ активных установок;6.4.5Gutenberg Blocks — YouTube, Vimeo, OpenStreetMap, Countdown Timer, OpenAI — FireBlocks;https://ru.wordpress.org/plugins/fireblocks/;Enhance your WordPress site with powerful Gutenberg Blocks for OpenStreetMap, YouTube, Vimeo, OpenStreetMap, Countdown, Notification, and more.;90+ активных установок;6.3.5Block Context;https://ru.wordpress.org/plugins/block-context/;Change Gutenberg block visibility for specific users.;80+ активных установок;5.7.12Waves Block;https://ru.wordpress.org/plugins/waves/;Gradients in motion.;70+ активных установок;6.0.9Gosign — Button Block;https://ru.wordpress.org/plugins/gosign-buttonblock/;This plugin creates a button block. it could be with icon, with custom url, border with different width and positions and alot of custom options.;70+ активных установок;6.0.9Image Effects;https://ru.wordpress.org/plugins/image-effects/;Gutenberg block to apply css filters  to image;70+ активных установок;6.8.1Charts Blocks for Gutenberg;https://ru.wordpress.org/plugins/charts-blocks/;Responsive, Interactive and Animated Charts in just two simple clicks. Select a Chart Block, Upload your CSV file and DONE. It's that easy!;70+ активных установок;5.7.12Gosign — Vimeo Video Player Block;https://ru.wordpress.org/plugins/gosign-vimeo-video-player-block/;Add Vimeo Video Player Block with custom splash image and also can set options for vimeo video player like autoplay, loop and many more.;70+ активных установок;5.8.10Gosign — Header Image Block;https://ru.wordpress.org/plugins/gosign-header-image-block/;This plugin enables you to add Header Image Block with image, headline and description.;60+ активных установок;6.0.9FAQ Builder AYS;https://ru.wordpress.org/plugins/faq-builder-ays/;Создавайте часто задаваемые вопросы и аккордеоны для своего веб-сайта WP без усилий с помощью FAQ Builder. Имеет Gutenberg Block, адаптивный дизайн, более 20 вариантов стиля и т. д.;60+ активных установок;6.8.1ACE HTML Block;https://ru.wordpress.org/plugins/ace-html-block/;Добавляет HTML-блок, который использует редактор ACE. Возможности: подсветка синтаксиса, номера строк, отступы и проверка HTML.;60+ активных установок;5.1.19Boxer Block;https://ru.wordpress.org/plugins/boxer-block/;Boxer is a Block that puts your WordPress posts into boxes on a page.;50+ активных установок;5.2.21The Permalinks Cascade;https://ru.wordpress.org/plugins/the-permalinks-cascade/;Sitemaps, Hyper-lists and Beyond.;50+ активных установок;6.1.7Illustrations Block — 300+ Customizable SVG Images;https://ru.wordpress.org/plugins/illustrations/;Illustrations Block enables you to add awesome SVG illustrations which you can customize directly from the new Editor (Gutenberg).;50+ активных установок;5.3.18Starscape Block;https://ru.wordpress.org/plugins/starscape/;Stars in motion;50+ активных установок;6.3.5Designer Blocks for Block Editor by Weaver;https://ru.wordpress.org/plugins/blocks-by-weaver/;Discover the power of the Block Editor! This plugin adds Designer Blocks that make it easy to add Images, Text, and Parallax.;50+ активных установок;5.0.22Schedule Revisions;https://ru.wordpress.org/plugins/schedule-revisions/;Control when content (or revisions) appear or disappear in your posts through a new Gutenberg block.;50+ активных установок;5.4.16Kenzap Timeline;https://ru.wordpress.org/plugins/kenzap-timeline/;A beautiful and easy customizable set of Gutenberg blocks to create timeline section for the new editor. Easily adjust the following parameters:;50+ активных установок;5.5.15Clapback;https://ru.wordpress.org/plugins/clapback/;The👏Clapback👏Block👏puts👏an👏emoji👏between👏your👏words.;50+ активных установок;6.7.2ProHotspots Lite — Image Gallery Hotspots;https://ru.wordpress.org/plugins/prohotpoints-gallery/;Create custom hotspots to make your images more informative and interactive using the WordPress blocks.;50+ активных установок;5.1.19startpage;https://ru.wordpress.org/plugins/startpage/;Создайте собственную начальную страницу для браузера в WordPress.;40+ активных установок;5.1.19Contact form builder for Gutenberg — Formello;https://ru.wordpress.org/plugins/formello/;Light-weight and easy plugin create forms inside the block editor.;40+ активных установок;6.8.1Simple Shortcode Block;https://ru.wordpress.org/plugins/simple-shortcode-block/;Простой блок для динамического выполнения шорткода в новом редакторе Gutenberg.;40+ активных установок;5.3.18Hero Banner Slider;https://ru.wordpress.org/plugins/hero-banner-slider/;WordPress Gutenberg editor plugin for Hero Banner Slider.;40+ активных установок;5.3.18Custom Accordion Block;https://ru.wordpress.org/plugins/custom-accordion-block/;This is Gutenberg compitable Custom Accordion plugin.;40+ активных установок;5.7.12Gecko Blocks;https://ru.wordpress.org/plugins/gecko-blocks/;Provides multiple basic block types to be used in custom themes.;30+ активных установок;5.4.16Lyrics;https://ru.wordpress.org/plugins/lyrics-block/;Добавьте лирику в записи и страницы WordPress.;30+ активных установок;5.1.19WordPress HelpDesk & Support Ticket System Plugin — Octrace Support;https://ru.wordpress.org/plugins/octrace-support/;Octrace Support is a help desk & support ticket system plugin that helps manage your support requests with ease directly from your WordPress site.;30+ активных установок;6.4.5WYSIWYG Calculator Block;https://ru.wordpress.org/plugins/wysiwyg-calculator-block/;This is a WYSIWYG build your own cost Calculator block. (Great for allowing customers to calculate things like tuition and program cost);30+ активных установок;5.4.16Gosign — Promo Box Block;https://ru.wordpress.org/plugins/gosign-promo-box-block/;This plugin enables you to add Promotion Boxes with text and button with a link.;30+ активных установок;6.0.9Testimonials Block;https://ru.wordpress.org/plugins/testimonials-block/;This plugin brings a testimonials slider block to the new WordPress Gutenberg editor.;30+ активных установок;5.0.22Custom Blocks Templates;https://ru.wordpress.org/plugins/custom-blocks-templates/;Create and set Gutenberg blocks templates for posts, pages and custom post types;30+ активных установок;6.2.6Kenzap Steps;https://ru.wordpress.org/plugins/kenzap-steps/;A beautiful and easy customizable set of Gutenberg blocks to create steps section for the new editor. Easily adjust the following parameters:;30+ активных установок;5.1.19DynaMaker CAD Configurator Integration;https://ru.wordpress.org/plugins/dynamaker-cad-configurator-integration/;With the DynaMaker Plugin for Wordpress you can easily display your online configurators in a Wordpress page or post, with very few clicks and short s …;30+ активных установок;6.5.5Max width container;https://ru.wordpress.org/plugins/maximum-width-container/;This plugin creates a new Gutenberg block, which allows you yo create a container with an adjustable maximun width, giving your perfect control over t …;30+ активных установок;5.2.21Kenzap Stats;https://ru.wordpress.org/plugins/kenzap-stats/;Extend your website with counters, countdowns, bars and other statistical elements. It should work out of the box though depending on the theme used y …;30+ активных установок;5.5.15Popup with exit intent, scroll triggered and anchor click for opt-ins, lead gen & more;https://ru.wordpress.org/plugins/popper/;A popup builder to increase Sales, Lead Generation, Conversion rates and receive good Call to Action with exit intent.;30+ активных установок;6.8.1Add Custom Messages Anywhere in WooCommerce;https://ru.wordpress.org/plugins/info-blocks-for-woocommerce/;Add any information blocks to your WooCommerce store, from product pages to cart and checkout, display tailored messages, product metadata, etc.;30+ активных установок;6.8.1User Blocks;https://ru.wordpress.org/plugins/user-blocks/;User blocks for building profile and account pages.;30+ активных установок;5.2.21Gosign — Post Teaser Block;https://ru.wordpress.org/plugins/gosign-post-teaser-block/;Its a post teaser block, where you select a post from the backend and it shows its data on the Frontend.;20+ активных установок;6.0.9WordPress Essential Blocks;https://ru.wordpress.org/plugins/wp-essential-blocks/;Powerful and Feature Rich Blocks for Gutenberg Editor.;20+ активных установок;5.0.22Guten-bubble;https://ru.wordpress.org/plugins/guten-bubble/;Displays a speech bubble like a chat conversation.;20+ активных установок;6.1.7Nelio Maps;https://ru.wordpress.org/plugins/nelio-maps/;Simple and beautiful Google Maps block for WordPress.;20+ активных установок;5.1.19QuestionPro Surveys;https://ru.wordpress.org/plugins/questionpro-surveys/;QuestionPro Surveys plugin lets you embed surveys into the blog content.;20+ активных установок;5.2.21Payment Form for PayPal Pro;https://ru.wordpress.org/plugins/payment-form-for-paypal-pro/;Payment Form for PayPal Pro for accepting credit cards directly into your website without navigating to a PayPal page.;20+ активных установок;6.8.1UniCard;https://ru.wordpress.org/plugins/unicard/;UniCard — A block plugin that can be used to create a card block with featured image, title, description fields. All fields are optional.;20+ активных установок;5.3.18Rad Bootstrap 3 Blocks;https://ru.wordpress.org/plugins/rad-bootstrap-3-blocks/;This plugin inserts bootstrap 3 style grid layout block and a button block to the gutenberg editor.;20+ активных установок;5.0.22Booking System Calendar;https://ru.wordpress.org/plugins/kenzap-calendar/;Display calendar section for appointments reservations or bookings. Specify custom time slots. Link checkout process with WooCommerce.;20+ активных установок;5.8.10Advanced Datatable – The Ultimate Data Table Plugin;https://ru.wordpress.org/plugins/advanced-datatable/;Show Data on your website with sorting, searching and pagination.;20+ активных установок;6.7.2Social Media Block;https://ru.wordpress.org/plugins/social-media-block/;Social media block for Gutenberg.;20+ активных установок;5.0.22Testimonial Gutenberg Block;https://ru.wordpress.org/plugins/testimonial-block/;Testimonial Gutenberg Block allows users add testimonials and display it anywhere in page/post. With more options and style support you easy to create …;20+ активных установок;5.2.21Qroko Blocks;https://ru.wordpress.org/plugins/qroko-blocks/;Custom Blocks for headless WordPress;20+ активных установок;5.7.12Posts List Block;https://ru.wordpress.org/plugins/posts-list-block/;"Adds a ""Blog Posts Listing"" block to the editor.";20+ активных установок;5.2.21Buttons for Gutenberg;https://ru.wordpress.org/plugins/fd-buttons-gutenberg/;Additional button styles and options of Button Block for Gutenberg/Block Editor. Best for marketing page, sales funnel, landing pages and call-to-acti …;10+ активных установок;6.7.2Gecko Grid Layout;https://ru.wordpress.org/plugins/gecko-grid-layout/;A css grid layout block for gutenberg. It allows you to create masonry like content. This could be a gallery, content flowing in unique ways, or whate …;10+ активных установок;5.1.19Blockbuddy;https://ru.wordpress.org/plugins/blockbuddy/;Gutenberg Block to easily query and display content from any post type!;10+ активных установок;5.1.0Video Block with Ads;https://ru.wordpress.org/plugins/video-block-with-ads/;Video Gutenberg Block and video player on steroids and low fat.;10+ активных установок;5.1.19Average Travel Costs;https://ru.wordpress.org/plugins/average-travel-costs/;Displays average daily travel costs from Budget Your Trip.;10+ активных установок;5.6.14Progress Bar Block;https://ru.wordpress.org/plugins/progress-bar-block/;Gutenberg block development plugin.;Менее 10 активных установок;5.0.22Mobile blocks;https://ru.wordpress.org/plugins/mobile-blocks/;Нужна помощь с мобильным сайтом? Хотите, чтобы ваши мобильные посетители были заинтересованы? Нужно увеличить конверсию продаж вашего магазина?;Менее 10 активных установок;5.9.10Code Snippet Beautifier;https://ru.wordpress.org/plugins/wplp-code-snippet/;This plugin is used for beautify Code Snippet on website.;Менее 10 активных установок;5.2.21Melonpan Block — Post List;https://ru.wordpress.org/plugins/melonpan-block-post-list/;Block that displays a list of selected Posts and Custom post types.;Менее 10 активных установок;5.6.14Advanced Archive Blocks;https://ru.wordpress.org/plugins/advanced-archive-blocks/;Add Archive Block support Yearly, Monthly, Daily, Weekly and Post Type.;Менее 10 активных установок;5.0.22HeBo Logo Slider Gutenberg Block;https://ru.wordpress.org/plugins/hebo-logo-slider-block/;Add a simple linkable logo slider to your website;Менее 10 активных установок;5.1.19Awesome Alert Blocks;https://ru.wordpress.org/plugins/awesome-alert-blocks/;Awesome Alert Blocks notices for the new WordPress block editor.;Менее 10 активных установок;5.0.22Payment Forms CustomBlock;https://ru.wordpress.org/plugins/payment-forms-customblock/;Gutenberg custom block with Stripe Form.;Менее 10 активных установок;5.5.15Nested Posts by CurateWP;https://ru.wordpress.org/plugins/curatewp-nested-posts/;Display a list of posts which includes descendants of the current page.;Менее 10 активных установок;5.2.21Draggable Images Block;https://ru.wordpress.org/plugins/draggable-images-block/;Add and move images in your Gutenberg block as you like.;Менее 10 активных установок;5.7.12Awesome Slider Block;https://ru.wordpress.org/plugins/awesome-slider-block/;This plugin brings a Awesome Slider Block to the new WordPress Gutenberg editor.;Менее 10 активных установок;5.1.19BlocksBuster;https://ru.wordpress.org/plugins/blocksbuster/;This plugin is a collection of blocks that will help in making WordPress sites by using Gutenberg editor. We will build more blocks in the future tha …;Менее 10 активных установок;5.0.22Blog Blocks — Gutenberg Blocks for Content Writers;https://ru.wordpress.org/plugins/blog-blocks/;Blocks for content writers to make your articles more attractive to readers with elements such as notices.;Менее 10 активных установок;5.2.21Social Gallery Block;https://ru.wordpress.org/plugins/social-gallery-block/;social Posts Display Block;Менее 10 активных установок;5.6.14gitblock — Github Block Plugin;https://ru.wordpress.org/plugins/gitblock/;Overview;Менее 10 активных установок;5.5.15Advance Block Extend;https://ru.wordpress.org/plugins/advance-block-extend/;The creative and advance blocks for the Gutenberg.;Менее 10 активных установок;5.5.15FF Block Advanced Columns;https://ru.wordpress.org/plugins/ff-block-advanced-columns/;WordPress editor block that provides support for advanced inline grid layouts by extending each column in a columns block with the option to set its w …;Менее 10 активных установок;5.2.21Builder Blocks;https://ru.wordpress.org/plugins/builder-blocks/;A library of simple, easy to use blocks for the new WordPress Gutenberg editor.;Менее 10 активных установок;5.0.22mowomo Google Reviews;https://ru.wordpress.org/plugins/mowomo-google-reviews/;mowomo Google Reviews is a plugin that allows you to display your Google company ratings on your website using a gutenberg block;Менее 10 активных установок;5.5.15Yasothon;https://ru.wordpress.org/plugins/yasothon-blocks/;Yasothon is a cool plugin for the Pages editor that have many several blocks to custom your homepage. It is easy to use you just add block and select  …;Менее 10 активных установок;5.1.19